{
  "$schema": "./theme.schema.json",
  "name": "evergreen",
  "logo": {
    "light": "/themes/evergreen-logo.svg",
    "dark": "/themes/evergreen-logo-dark.svg"
  },
  "light": {
    "font-sans": "Georgia, \"Times New Roman\", serif",
    "radius-md": "0.5rem",
    "radius-lg": "0.875rem",
    "radius-xl": "1.25rem",
    "page": "#f7f5ef",
    "surface": "#fffdf8",
    "surface-raised": "#fffdf8",
    "band": "#eee9dc",
    "muted": "#eee9dc",
    "muted-hover": "#e2dccb",
    "heading": "#1c2b22",
    "fg-strong": "#14201a",
    "fg": "#23302a",
    "fg-2": "#34443b",
    "fg-muted": "#4b5a51",
    "accent": "#1f7a4d",
    "accent-hover": "#17603c",
    "on-accent-muted": "#d4eddc",
    "link": "#1f7a4d",
    "link-hover": "#17603c",
    "accent-soft": "#dcefe3",
    "accent-soft-hover": "#c5e5d1",
    "accent-soft-fg": "#17603c",
    "accent-tint": "#dcefe3",
    "selected": "#dcefe3",
    "focus": "#2f9e63",
    "line": "#e2dccb",
    "line-strong": "#e2dccb",
    "line-input": "#cfc7b2",
    "hero-start": "#f7f5ef",
    "hero-end": "#dcefe3",
    "cta-start": "#1f7a4d",
    "cta-end": "#0f766e",
    "chart-1": "#2f9e63",
    "chart-2": "#c2410c"
  },
  "dark": {
    "page": "#101a14",
    "surface": "#17241c",
    "surface-raised": "#213127",
    "band": "#17241c",
    "muted": "#213127",
    "muted-hover": "#2c4034",
    "heading": "#f3f7f2",
    "fg-strong": "#eef4ee",
    "fg": "#e3ebe4",
    "fg-2": "#cfdcd2",
    "fg-muted": "#b4c4b8",
    "accent": "#2f9e63",
    "accent-hover": "#1f7a4d",
    "on-accent-muted": "#c5e5d1",
    "link": "#6fcf97",
    "link-hover": "#4fbf80",
    "accent-soft": "#213127",
    "accent-soft-hover": "#2c4034",
    "accent-soft-fg": "#9be0b6",
    "accent-tint": "color-mix(in oklab, #2f9e63 20%, transparent)",
    "selected": "color-mix(in oklab, #1f7a4d 30%, transparent)",
    "focus": "#6fcf97",
    "line": "#2c4034",
    "line-strong": "#3a5243",
    "line-input": "#3a5243",
    "hero-start": "#17241c",
    "hero-end": "#123a2a",
    "cta-start": "#17603c",
    "cta-end": "#115e59"
  }
}
